{
  "schema_version": "1.0",
  "skill": "tw-edu-homeroom-operations",
  "language": "zh-TW",
  "context": {
    "subject": "導師班級經營",
    "grade": "國中七年級",
    "topic": "開學第一週建班"
  },
  "sources": [
    {
      "title": "教師提供之班級情境描述",
      "status": "user_provided"
    },
    {
      "title": "國民小學與國民中學未入學或中途輟學學生通報及復學輔導辦法第2、3條",
      "status": "verified",
      "url": "https://law.moj.gov.tw/LawClass/LawAll.aspx?pcode=H0070015"
    }
  ],
  "content": {
    "title": "七年級開學建班與例行事務規劃（範例）",
    "period": "開學建班",
    "class_profile": "新生 27 人，來自 6 所國小；家長聯絡以聯絡簿與學校通訊軟體為主；2 位學生已有特教服務（細節依特教組資料，不列於本文件）。",
    "boundaries": {
      "admin_procedures": [
        "缺席通報與中輟通報依學務處與註冊組流程",
        "特教與輔導資料依原單位規定轉銜與調閱",
        "學生獎懲依學校獎懲規定提會"
      ],
      "class_decisions": [
        "座位安排原則與輪換週期",
        "班級幹部職務內容與輪替",
        "教室清潔與午餐分工",
        "班級載具使用約定"
      ]
    },
    "routines": [
      {
        "name": "早自習與到校確認",
        "owner": "學生幹部",
        "when": "每日 07:30–07:50",
        "steps": [
          "風紀股長 07:45 核對到校名單",
          "未到者回報導師",
          "導師 08:00 前確認請假或聯繫家長"
        ],
        "check": "每週五導師核對點名表與校務系統紀錄是否一致"
      },
      {
        "name": "午餐與整潔",
        "owner": "全班輪值",
        "when": "每日 12:00–12:40",
        "steps": [
          "值日生依輪值表打菜",
          "餐後分類回收",
          "衛生股長檢核並簽名"
        ],
        "check": "輪值表張貼於公布欄，每兩週輪換"
      },
      {
        "name": "聯絡簿",
        "owner": "導師",
        "when": "每日放學前",
        "steps": [
          "學生抄寫作業與重要事項",
          "導師隔日早上批閱並回覆家長留言",
          "個別事項改以私訊或電話"
        ],
        "check": "家長留言 1 個上課日內回覆"
      }
    ],
    "roles": [
      {
        "role": "風紀股長",
        "tasks": [
          "早自習點名",
          "提醒上課準備"
        ],
        "authority": "提醒與紀錄，不處罰同學",
        "rotation": "每學期改選",
        "support": "導師每週面談 5 分鐘，處理困難情況"
      },
      {
        "role": "衛生股長",
        "tasks": [
          "打掃分配",
          "整潔檢核"
        ],
        "authority": "安排工作與回報",
        "rotation": "每學期改選",
        "support": "導師示範第一週檢核方式"
      }
    ],
    "attendance": {
      "daily_check": "08:00 前比對到校名單與請假紀錄",
      "follow_up": [
        "當日未到且未請假：08:30 前聯繫家長",
        "連續 2 日未到：與學務處生教組討論關懷方式"
      ],
      "alert_threshold": "未經請假或原因不明連續達 3 日即依法通報（依學校註冊組流程）",
      "notify": [
        "學務處生教組",
        "註冊組",
        "輔導室（需要時）"
      ],
      "basis": "國民小學與國民中學未入學或中途輟學學生通報及復學輔導辦法第2、3條"
    },
    "communication": [
      {
        "channel": "聯絡簿",
        "purpose": "每日作業與一般提醒",
        "frequency": "每日",
        "privacy_rule": "不寫個別學生的行為問題或成績比較"
      },
      {
        "channel": "班級群組",
        "purpose": "全班性活動通知",
        "frequency": "需要時",
        "privacy_rule": "不討論個別學生；個別事項改私訊或電話"
      }
    ],
    "device_agreement": [
      "上課時載具依教師指示開啟",
      "手機到校後關機收入書包或依學校規定保管",
      "違反約定先提醒，再與學生個別討論，必要時通知家長"
    ],
    "timeline": [
      {
        "when": "開學前一週",
        "tasks": [
          "閱讀學務、特教轉銜資料（限必要範圍）",
          "準備座位表與輪值表草案"
        ]
      },
      {
        "when": "開學第一週",
        "tasks": [
          "班級共識討論",
          "幹部說明與選舉",
          "建立聯絡簿與群組規則"
        ]
      },
      {
        "when": "第三週",
        "tasks": [
          "檢視例行程序執行情形並調整",
          "第一次親師溝通（班親會準備）"
        ]
      }
    ],
    "pending": [
      "學校手機保管規定是否有統一版本",
      "班級群組是否使用學校認可的平台"
    ]
  }
}
